<?xml version="1.0"?>

<student xmlns="https://www.example.com"
  xmlns:xsi="http://www.w3.org/2001/XMLSchema-instance"
  xsi:schemaLocation="https://www.example.com schema.xsd"
  id="1345">
  <name>
    <lastName>Stark</lastName>
    <givenName>Tony</givenName>
    <middleName></middleName>
  </name>
  <birthDate>1992-10-09</birthDate>
  <gender>Male</gender>
  <contactDetails>
    <emailAddress>tony.stark@email.com</emailAddress>
    <mobileNumber>09171234567</mobileNumber>
  </contactDetails>
  <address>
    <line1>#01 Sample St.</line1>
    <city>City of Malolos</city>
    <province>Bulacan</province>
  </address>
  <yearLevel>2</yearLevel>
  <course>Information Technology</course>
  <campus>Malolos</campus>
  <gwa>1.85</gwa>
  <isEnrolled>true</isEnrolled>
  <dateEnrolled>2025-01-05T09:30:00+08:00</dateEnrolled>
  <subjects>
    <subject>System Integration 1</subject>
    <subject>Networking 2</subject>
    <subject>Programming 2</subject>
  </subjects>
</student>